{"schema":"sand-iam.consumer-acceptance-v2-plan/v1","run_id":"consumer_l04_v2_template","candidate":{"candidate_sha256":"1111111111111111111111111111111111111111111111111111111111111111","host_sha256":"2222222222222222222222222222222222222222222222222222222222222222","clean_host_revision_sha256":"3333333333333333333333333333333333333333333333333333333333333333","tree_a_sha256":"4444444444444444444444444444444444444444444444444444444444444444","tree_b_sha256":"5555555555555555555555555555555555555555555555555555555555555555"},"origins":{"iam":"https://iam.example.test","a":"https://a.example.test","b":"https://b.example.test"},"database":{"iam":{"role":"iam_role","schema_fingerprint_sha256":"6666666666666666666666666666666666666666666666666666666666666666"},"a":{"role":"a_role","schema_fingerprint_sha256":"7777777777777777777777777777777777777777777777777777777777777777"},"b":{"role":"b_role","schema_fingerprint_sha256":"8888888888888888888888888888888888888888888888888888888888888888"}},"scope_cleanup":{"scope_sha256":"9999999999999999999999999999999999999999999999999999999999999999","cleanup_sha256":"aaaaaaaaaaaaaaaaaaaaaaaaaaaaaaaaaaaaaaaaaaaaaaaaaaaaaaaaaaaaaaaa"},"fixture_manifest_sha256":"bbbbbbbbbbbbbbbbbbbbbbbbbbbbbbbbbbbbbbbbbbbbbbbbbbbbbbbbbbbbbbbb","actions":["iam_login","a_decide","a_session_revoke","a_consumer_read","a_consumer_close","b_issue","b_verify","b_provider_process","admin_credential_revoke","admin_grant_revoke","admin_audit"],"secret_slots":{"iam_admin":"SAND_IAM_ADMIN_TOKEN","a_user":"CONSUMER_A_USER_TOKEN","b_workload":"PROVIDER_B_WORKLOAD_CREDENTIAL"}}
